### ISSUE TITLE
打开rtmp链接，报错failed to open player，抓包onStatus('NetStream.Play.StreamNotFound')

### ISSUE THREAD

**Issue by ztc464728422** [pili-engineering/PLDroidPlayer#942]
出错时流媒体服务器是red5(https://github.com/Red5/red5-server)，如果换成Nginx（https://github.com/illuspas/nginx-rtmp-win32）则可以正常播放。

推流都是用ffmpeg（ffmpeg -re -i D:\honghai.mp4 -c copy -f flv rtmp://10.0.2.10:1941/live/test5）

播放端是2.1.3版本，如果使用1.6版本，点播可以播放，直播不可以。之前也看到是说1.6版本mAVOptions.setInteger(AVOptions.KEY_LIVE_STREAMING, 1); //这里把1改成0就可以了
但是新版本把这个参数去掉了，所以直播点播都无法播放。

以下是报错时的Wireshark抓包信息：主要在最后的onStatus('NetStream.Play.StreamNotFound')

No.     Time           Source                Destination           Protocol Length Info
      **5 0.006152       172.23.2.4            10.0.2.10             RTMP     291    Handshake C0+C1**

Frame 5: 291 bytes on wire (2328 bits), 291 bytes captured (2328 bits) on interface 0
Ethernet II, Src: XiaomiCo_18:45:ed (00:ec:0a:18:45:ed), Dst: 2a:e3:47:b5:dc:fc (2a:e3:47:b5:dc:fc)
Internet Protocol Version 4, Src: 172.23.2.4, Dst: 10.0.2.10
Transmission Control Protocol, Src Port: 45903, Dst Port: 1941, Seq: 1301, Ack: 1, Len: 237
Real Time Messaging Protocol (Handshake C0+C1)

No.     Time           Source                Destination           Protocol Length Info
     **12 0.020803       10.0.2.10             172.23.2.4            RTMP     527    Handshake S0+S1+S2**

Frame 12: 527 bytes on wire (4216 bits), 527 bytes captured (4216 bits) on interface 0
Ethernet II, Src: 2a:e3:47:b5:dc:fc (2a:e3:47:b5:dc:fc), Dst: XiaomiCo_18:45:ed (00:ec:0a:18:45:ed)
Internet Protocol Version 4, Src: 10.0.2.10, Dst: 172.23.2.4
Transmission Control Protocol, Src Port: 1941, Dst Port: 45903, Seq: 2601, Ack: 1538, Len: 473
Real Time Messaging Protocol (Handshake S0+S1+S2)

No.     Time           Source                Destination           Protocol Length Info
     15 0.021073       172.23.2.4            10.0.2.10             RTMP     290    Handshake C2

Frame 15: 290 bytes on wire (2320 bits), 290 bytes captured (2320 bits) on interface 0
Ethernet II, Src: XiaomiCo_18:45:ed (00:ec:0a:18:45:ed), Dst: 2a:e3:47:b5:dc:fc (2a:e3:47:b5:dc:fc)
Internet Protocol Version 4, Src: 172.23.2.4, Dst: 10.0.2.10
Transmission Control Protocol, Src Port: 45903, Dst Port: 1941, Seq: 2838, Ack: 2601, Len: 236
Real Time Messaging Protocol (Handshake C2)

No.     Time           Source                Destination           Protocol Length Info
     19 0.022241       172.23.2.4            10.0.2.10             RTMP     97     connect('live')

Frame 19: 97 bytes on wire (776 bits), 97 bytes captured (776 bits) on interface 0
Ethernet II, Src: XiaomiCo_18:45:ed (00:ec:0a:18:45:ed), Dst: 2a:e3:47:b5:dc:fc (2a:e3:47:b5:dc:fc)
Internet Protocol Version 4, Src: 172.23.2.4, Dst: 10.0.2.10
Transmission Control Protocol, Src Port: 45903, Dst Port: 1941, Seq: 3214, Ack: 3074, Len: 43
Real Time Messaging Protocol (AMF0 Command connect('live'))

No.     Time           Source                Destination           Protocol Length Info
     22 0.040662       10.0.2.10             172.23.2.4            RTMP     70     Window Acknowledgement Size 10000000

Frame 22: 70 bytes on wire (560 bits), 70 bytes captured (560 bits) on interface 0
Ethernet II, Src: 2a:e3:47:b5:dc:fc (2a:e3:47:b5:dc:fc), Dst: XiaomiCo_18:45:ed (00:ec:0a:18:45:ed)
Internet Protocol Version 4, Src: 10.0.2.10, Dst: 172.23.2.4
Transmission Control Protocol, Src Port: 1941, Dst Port: 45903, Seq: 3074, Ack: 3257, Len: 16
Real Time Messaging Protocol (Window Acknowledgement Size 10000000)

No.     Time           Source                Destination           Protocol Length Info
     23 0.040729       10.0.2.10             172.23.2.4            RTMP     67     Set Peer Bandwidth 10000000,Dynamic

Frame 23: 67 bytes on wire (536 bits), 67 bytes captured (536 bits) on interface 0
Ethernet II, Src: 2a:e3:47:b5:dc:fc (2a:e3:47:b5:dc:fc), Dst: XiaomiCo_18:45:ed (00:ec:0a:18:45:ed)
Internet Protocol Version 4, Src: 10.0.2.10, Dst: 172.23.2.4
Transmission Control Protocol, Src Port: 1941, Dst Port: 45903, Seq: 3090, Ack: 3257, Len: 13
Real Time Messaging Protocol (Set Peer Bandwidth 10000000,Dynamic)

No.     Time           Source                Destination           Protocol Length Info
     24 0.040757       10.0.2.10             172.23.2.4            RTMP     68     Stream Begin 0

Frame 24: 68 bytes on wire (544 bits), 68 bytes captured (544 bits) on interface 0
Ethernet II, Src: 2a:e3:47:b5:dc:fc (2a:e3:47:b5:dc:fc), Dst: XiaomiCo_18:45:ed (00:ec:0a:18:45:ed)
Internet Protocol Version 4, Src: 10.0.2.10, Dst: 172.23.2.4
Transmission Control Protocol, Src Port: 1941, Dst Port: 45903, Seq: 3103, Ack: 3257, Len: 14
Real Time Messaging Protocol (User Control Message Stream Begin 0)

No.     Time           Source                Destination           Protocol Length Info
     **25 0.040781       10.0.2.10             172.23.2.4            RTMP     293    _result('NetConnection.Connect.Success')**

Frame 25: 293 bytes on wire (2344 bits), 293 bytes captured (2344 bits) on interface 0
Ethernet II, Src: 2a:e3:47:b5:dc:fc (2a:e3:47:b5:dc:fc), Dst: XiaomiCo_18:45:ed (00:ec:0a:18:45:ed)
Internet Protocol Version 4, Src: 10.0.2.10, Dst: 172.23.2.4
Transmission Control Protocol, Src Port: 1941, Dst Port: 45903, Seq: 3117, Ack: 3257, Len: 239
Real Time Messaging Protocol (AMF0 Command _result('NetConnection.Connect.Success'))

No.     Time           Source                Destination           Protocol Length Info
     **27 0.064565       172.23.2.4            10.0.2.10             RTMP     70     Window Acknowledgement Size 10000000**

Frame 27: 70 bytes on wire (560 bits), 70 bytes captured (560 bits) on interface 0
Ethernet II, Src: XiaomiCo_18:45:ed (00:ec:0a:18:45:ed), Dst: 2a:e3:47:b5:dc:fc (2a:e3:47:b5:dc:fc)
Internet Protocol Version 4, Src: 172.23.2.4, Dst: 10.0.2.10
Transmission Control Protocol, Src Port: 45903, Dst Port: 1941, Seq: 3257, Ack: 3356, Len: 16
Real Time Messaging Protocol (Window Acknowledgement Size 10000000)

No.     Time           Source                Destination           Protocol Length Info
     **28 0.064566       172.23.2.4            10.0.2.10             RTMP     105    createStream()**

Frame 28: 105 bytes on wire (840 bits), 105 bytes captured (840 bits) on interface 0
Ethernet II, Src: XiaomiCo_18:45:ed (00:ec:0a:18:45:ed), Dst: 2a:e3:47:b5:dc:fc (2a:e3:47:b5:dc:fc)
Internet Protocol Version 4, Src: 172.23.2.4, Dst: 10.0.2.10
Transmission Control Protocol, Src Port: 45903, Dst Port: 1941, Seq: 3273, Ack: 3356, Len: 51
Real Time Messaging Protocol (AMF0 Command createStream())

No.     Time           Source                Destination           Protocol Length Info
     **31 0.065491       10.0.2.10             172.23.2.4            RTMP     91     _result()**

Frame 31: 91 bytes on wire (728 bits), 91 bytes captured (728 bits) on interface 0
Ethernet II, Src: 2a:e3:47:b5:dc:fc (2a:e3:47:b5:dc:fc), Dst: XiaomiCo_18:45:ed (00:ec:0a:18:45:ed)
Internet Protocol Version 4, Src: 10.0.2.10, Dst: 172.23.2.4
Transmission Control Protocol, Src Port: 1941, Dst Port: 45903, Seq: 3356, Ack: 3324, Len: 37
Real Time Messaging Protocol (AMF0 Command _result())

No.     Time           Source                Destination           Protocol Length Info
     **32 0.073188       172.23.2.4            10.0.2.10             RTMP     100    play('test5')**

Frame 32: 100 bytes on wire (800 bits), 100 bytes captured (800 bits) on interface 0
Ethernet II, Src: XiaomiCo_18:45:ed (00:ec:0a:18:45:ed), Dst: 2a:e3:47:b5:dc:fc (2a:e3:47:b5:dc:fc)
Internet Protocol Version 4, Src: 172.23.2.4, Dst: 10.0.2.10
Transmission Control Protocol, Src Port: 45903, Dst Port: 1941, Seq: 3324, Ack: 3393, Len: 46
Real Time Messaging Protocol (AMF0 Command play('test5'))

No.     Time           Source                Destination           Protocol Length Info
     **33 0.073189       172.23.2.4            10.0.2.10             RTMP     65     Set Buffer Length 1,30000ms**

Frame 33: 65 bytes on wire (520 bits), 65 bytes captured (520 bits) on interface 0
Ethernet II, Src: XiaomiCo_18:45:ed (00:ec:0a:18:45:ed), Dst: 2a:e3:47:b5:dc:fc (2a:e3:47:b5:dc:fc)
Internet Protocol Version 4, Src: 172.23.2.4, Dst: 10.0.2.10
Transmission Control Protocol, Src Port: 45903, Dst Port: 1941, Seq: 3370, Ack: 3393, Len: 11
Real Time Messaging Protocol (User Control Message Set Buffer Length 1,30000ms)

No.     Time           Source                Destination           Protocol Length Info
     **## 36 0.077480       10.0.2.10             172.23.2.4            RTMP     197    onStatus('NetStream.Play.StreamNotFound')**

Frame 36: 197 bytes on wire (1576 bits), 197 bytes captured (1576 bits) on interface 0
Ethernet II, Src: 2a:e3:47:b5:dc:fc (2a:e3:47:b5:dc:fc), Dst: XiaomiCo_18:45:ed (00:ec:0a:18:45:ed)
Internet Protocol Version 4, Src: 10.0.2.10, Dst: 172.23.2.4
Transmission Control Protocol, Src Port: 1941, Dst Port: 45903, Seq: 3393, Ack: 3381, Len: 143
Real Time Messaging Protocol (AMF0 Command onStatus('NetStream.Play.StreamNotFound'))

No.     Time           Source                Destination           Protocol Length Info
     **47 0.094829       172.23.2.4            10.0.2.10             RTMP     291    Handshake C0+C1**

Frame 47: 291 bytes on wire (2328 bits), 291 bytes captured (2328 bits) on interface 0
Ethernet II, Src: XiaomiCo_18:45:ed (00:ec:0a:18:45:ed), Dst: 2a:e3:47:b5:dc:fc (2a:e3:47:b5:dc:fc)
Internet Protocol Version 4, Src: 172.23.2.4, Dst: 10.0.2.10
Transmission Control Protocol, Src Port: 45904, Dst Port: 1941, Seq: 1301, Ack: 1, Len: 237
Real Time Messaging Protocol (Handshake C0+C1)
